{
  "schema": "echelon.construction-trace",
  "schemaVersion": "0.1",
  "handoff": {
    "handoffId": "HND-INVOICE-SLICE-001",
    "sha256": "sha256:ec5d0e6a4343b1774d40760c04af200a9b71147940305d1ddbabbc5c6db68bcd"
  },
  "generator": {
    "name": "echelon.verified-construction",
    "version": "0.1.0+ordo.construction/4"
  },
  "constructs": [
    {
      "symbol": "Invoice.Slice.PaymentsService.CompositionRoot.capability",
      "kind": "capability",
      "file": "src/Invoice.Slice.PaymentsService/CompositionRoot.fs",
      "disposition": "authorized",
      "authority": [
        {
          "kind": "decision",
          "id": "DEC-FIN-002"
        }
      ]
    },
    {
      "symbol": "Invoice.Slice.PaymentsService.CompositionRoot.recordAndPersist",
      "kind": "port",
      "file": "src/Invoice.Slice.PaymentsService/CompositionRoot.fs",
      "disposition": "authorized",
      "authority": [
        {
          "kind": "requirement",
          "id": "REQ-INV-001"
        },
        {
          "kind": "requirement",
          "id": "REQ-INV-002"
        },
        {
          "kind": "requirement",
          "id": "REQ-INV-003"
        },
        {
          "kind": "decision",
          "id": "DEC-FIN-001"
        },
        {
          "kind": "decision",
          "id": "DEC-FIN-002"
        }
      ]
    },
    {
      "symbol": "Invoice.Slice.Invoicing.AppliedPayment",
      "kind": "value-type",
      "file": "src/Invoice.Slice/Invoicing.fs",
      "disposition": "authorized",
      "authority": [
        {
          "kind": "requirement",
          "id": "REQ-INV-002"
        },
        {
          "kind": "requirement",
          "id": "REQ-INV-003"
        },
        {
          "kind": "invariant",
          "id": "INV-INV-003"
        }
      ]
    },
    {
      "symbol": "Invoice.Slice.Invoicing.Invoice",
      "kind": "value-type",
      "file": "src/Invoice.Slice/Invoicing.fs",
      "disposition": "authorized",
      "authority": [
        {
          "kind": "requirement",
          "id": "REQ-INV-001"
        },
        {
          "kind": "requirement",
          "id": "REQ-INV-002"
        },
        {
          "kind": "invariant",
          "id": "INV-INV-001"
        },
        {
          "kind": "invariant",
          "id": "INV-INV-002"
        }
      ]
    },
    {
      "symbol": "Invoice.Slice.Invoicing.Refusal",
      "kind": "refusal",
      "file": "src/Invoice.Slice/Invoicing.fs",
      "disposition": "authorized",
      "authority": [
        {
          "kind": "requirement",
          "id": "REQ-INV-001"
        },
        {
          "kind": "requirement",
          "id": "REQ-INV-002"
        },
        {
          "kind": "question",
          "id": "Q-FIN-001"
        }
      ]
    },
    {
      "symbol": "Invoice.Slice.Invoicing.create",
      "kind": "transition",
      "file": "src/Invoice.Slice/Invoicing.fs",
      "disposition": "authorized",
      "authority": [
        {
          "kind": "requirement",
          "id": "REQ-INV-001"
        }
      ]
    },
    {
      "symbol": "Invoice.Slice.Invoicing.issue",
      "kind": "transition",
      "file": "src/Invoice.Slice/Invoicing.fs",
      "disposition": "authorized",
      "authority": [
        {
          "kind": "requirement",
          "id": "REQ-INV-001"
        }
      ]
    },
    {
      "symbol": "Invoice.Slice.Invoicing.pay",
      "kind": "transition",
      "file": "src/Invoice.Slice/Invoicing.fs",
      "disposition": "authorized",
      "authority": [
        {
          "kind": "requirement",
          "id": "REQ-INV-001"
        },
        {
          "kind": "requirement",
          "id": "REQ-INV-002"
        },
        {
          "kind": "decision",
          "id": "DEC-FIN-001"
        }
      ]
    },
    {
      "symbol": "Invoice.Slice.Invoicing.pendingQuestion",
      "kind": "refusal",
      "file": "src/Invoice.Slice/Invoicing.fs",
      "disposition": "deferred-pending-question",
      "authority": [
        {
          "kind": "question",
          "id": "Q-FIN-001"
        }
      ]
    },
    {
      "symbol": "Invoice.Slice.Invoicing.recordPayment",
      "kind": "transition",
      "file": "src/Invoice.Slice/Invoicing.fs",
      "disposition": "authorized",
      "authority": [
        {
          "kind": "requirement",
          "id": "REQ-INV-001"
        },
        {
          "kind": "requirement",
          "id": "REQ-INV-002"
        },
        {
          "kind": "decision",
          "id": "DEC-FIN-001"
        },
        {
          "kind": "invariant",
          "id": "INV-INV-001"
        },
        {
          "kind": "invariant",
          "id": "INV-INV-002"
        },
        {
          "kind": "invariant",
          "id": "INV-INV-003"
        }
      ]
    },
    {
      "symbol": "Invoice.Slice.Invoicing.settledWhen",
      "kind": "transition",
      "file": "src/Invoice.Slice/Invoicing.fs",
      "disposition": "authorized",
      "authority": [
        {
          "kind": "requirement",
          "id": "REQ-INV-002"
        },
        {
          "kind": "invariant",
          "id": "INV-INV-002"
        }
      ]
    },
    {
      "symbol": "Invoice.Slice.Invoicing.voidInvoice",
      "kind": "transition",
      "file": "src/Invoice.Slice/Invoicing.fs",
      "disposition": "authorized",
      "authority": [
        {
          "kind": "requirement",
          "id": "REQ-INV-001"
        },
        {
          "kind": "question",
          "id": "Q-FIN-001"
        }
      ]
    },
    {
      "symbol": "Invoice.Slice.Invoicing.wireCode",
      "kind": "refusal",
      "file": "src/Invoice.Slice/Invoicing.fs",
      "disposition": "authorized",
      "authority": [
        {
          "kind": "requirement",
          "id": "REQ-INV-001"
        },
        {
          "kind": "requirement",
          "id": "REQ-INV-002"
        },
        {
          "kind": "decision",
          "id": "DEC-FIN-001"
        },
        {
          "kind": "question",
          "id": "Q-FIN-001"
        }
      ]
    },
    {
      "symbol": "Invoice.Slice.Money.PositiveAmount",
      "kind": "value-type",
      "file": "src/Invoice.Slice/Money.fs",
      "disposition": "authorized",
      "authority": [
        {
          "kind": "requirement",
          "id": "REQ-INV-002"
        }
      ]
    },
    {
      "symbol": "Invoice.Slice.Money.positiveAmount",
      "kind": "validated-constructor",
      "file": "src/Invoice.Slice/Money.fs",
      "disposition": "authorized",
      "authority": [
        {
          "kind": "requirement",
          "id": "REQ-INV-002"
        }
      ]
    },
    {
      "symbol": "Invoice.Slice.Payment.PaymentLimit",
      "kind": "value-type",
      "file": "src/Invoice.Slice/Payment.fs",
      "disposition": "authorized",
      "authority": [
        {
          "kind": "requirement",
          "id": "REQ-INV-002"
        },
        {
          "kind": "decision",
          "id": "DEC-FIN-001"
        }
      ]
    },
    {
      "symbol": "Invoice.Slice.Payment.ValidatedPayment",
      "kind": "value-type",
      "file": "src/Invoice.Slice/Payment.fs",
      "disposition": "authorized",
      "authority": [
        {
          "kind": "requirement",
          "id": "REQ-INV-002"
        },
        {
          "kind": "decision",
          "id": "DEC-FIN-001"
        }
      ]
    },
    {
      "symbol": "Invoice.Slice.Payment.decFin001",
      "kind": "constant",
      "file": "src/Invoice.Slice/Payment.fs",
      "disposition": "authorized",
      "authority": [
        {
          "kind": "decision",
          "id": "DEC-FIN-001"
        }
      ]
    },
    {
      "symbol": "Invoice.Slice.Payment.exceedsLimit",
      "kind": "refusal",
      "file": "src/Invoice.Slice/Payment.fs",
      "disposition": "authorized",
      "authority": [
        {
          "kind": "decision",
          "id": "DEC-FIN-001"
        }
      ]
    },
    {
      "symbol": "Invoice.Slice.Payment.validate",
      "kind": "validated-constructor",
      "file": "src/Invoice.Slice/Payment.fs",
      "disposition": "authorized",
      "authority": [
        {
          "kind": "requirement",
          "id": "REQ-INV-002"
        },
        {
          "kind": "decision",
          "id": "DEC-FIN-001"
        }
      ]
    },
    {
      "symbol": "Invoice.Slice.Persistence.PaymentStore",
      "kind": "port",
      "file": "src/Invoice.Slice/Persistence.fs",
      "disposition": "authorized",
      "authority": [
        {
          "kind": "requirement",
          "id": "REQ-INV-003"
        },
        {
          "kind": "decision",
          "id": "DEC-FIN-002"
        }
      ]
    },
    {
      "symbol": "Invoice.Slice.Persistence.PaymentsServiceCapability",
      "kind": "capability",
      "file": "src/Invoice.Slice/Persistence.fs",
      "disposition": "authorized",
      "authority": [
        {
          "kind": "requirement",
          "id": "REQ-INV-003"
        },
        {
          "kind": "decision",
          "id": "DEC-FIN-002"
        }
      ]
    },
    {
      "symbol": "Invoice.Slice.Persistence.persist",
      "kind": "port",
      "file": "src/Invoice.Slice/Persistence.fs",
      "disposition": "authorized",
      "authority": [
        {
          "kind": "requirement",
          "id": "REQ-INV-003"
        },
        {
          "kind": "decision",
          "id": "DEC-FIN-002"
        }
      ]
    },
    {
      "symbol": "Invoice.Slice.Probe.start",
      "kind": "transition",
      "file": "src/Invoice.Slice/Probe.fs",
      "disposition": "authorized",
      "authority": [
        {
          "kind": "requirement",
          "id": "REQ-INV-001"
        },
        {
          "kind": "requirement",
          "id": "REQ-INV-002"
        }
      ]
    },
    {
      "symbol": "Invoice.Slice.Probe.step",
      "kind": "transition",
      "file": "src/Invoice.Slice/Probe.fs",
      "disposition": "authorized",